{
  "schema_version": "1",
  "id": "everest-stat",
  "display_title": "珠穆朗玛峰高度测量结果",
  "template": "news-stat",
  "voice": "zh-CN-XiaoxiaoNeural",
  "facts": [
    {
      "claim": "2020 年 12 月 8 日中国与尼泊尔联合公布珠穆朗玛峰雪面高程 8848.86 米",
      "source_url": "https://en.wikipedia.org/wiki/Mount_Everest",
      "source_label": "维基百科 (英)",
      "source_fingerprint_sha256": "f70fb698bebb3d6dc2d6cf7c0d3437245c594a243107b8d4ec5a91f26bb060f5"
    },
    {
      "claim": "珠穆朗玛峰位于喜马拉雅山脉中段中国西藏与尼泊尔边境",
      "source_url": "https://en.wikipedia.org/wiki/Himalayas",
      "source_label": "维基百科 (英)",
      "source_fingerprint_sha256": "6a9d8cdc49bb57f9a55beeecf44ca095f879c15948b20c2edd893e4cd7437a35"
    },
    {
      "claim": "1953 年 5 月 29 日埃德蒙·希拉里与丹增·诺尔盖首次成功登顶珠峰",
      "source_url": "https://en.wikipedia.org/wiki/1953_British_Mount_Everest_expedition",
      "source_label": "维基百科 (英)",
      "source_fingerprint_sha256": "9cff4f04a75de60b066451a051e9e2a322153a9bc94e7cb3a0567c4774b4d0e7"
    }
  ],
  "images": [
    {
      "scene_position": 1,
      "wikimedia_url": "https://commons.wikimedia.org/wiki/File:Everest,_Himalayas.jpg",
      "license_spdx": "CC-BY-4.0",
      "credit": "Vyacheslav Argenberg (Wikimedia Commons)",
      "source_fingerprint_sha256": "cb1276e97323a806450740e3e4b6c70b62bca676bcb7e4018dda597c552e6946"
    },
    {
      "scene_position": 3,
      "wikimedia_url": "https://commons.wikimedia.org/wiki/File:Mount_Everest_North_Face.jpg",
      "license_spdx": "CC-BY-SA-3.0",
      "credit": "Carsten.nebel (Wikimedia Commons)",
      "source_fingerprint_sha256": "ff73db05d43f7c788356c11d6f9bd674727ecedb97d3397aa5efe1e4652fab4d"
    },
    {
      "scene_position": 5,
      "wikimedia_url": "https://commons.wikimedia.org/wiki/File:Sunset_view_of_Everest.jpg",
      "license_spdx": "CC-BY-SA-4.0",
      "credit": "Nir B. Gurung (Wikimedia Commons)",
      "source_fingerprint_sha256": "d4a3e96b2950e9c184d71bb7f1fa5671906a4507166456411af50ca43234f5ed"
    }
  ],
  "scenes": [
    {
      "position": 1,
      "layout": "hook",
      "kicker": "数据看点",
      "title": "世界之巅",
      "body": "珠穆朗玛峰最新高程测量结果公布",
      "onscreen": "8848.86米｜世界之巅"
    },
    {
      "position": 2,
      "layout": "stat",
      "kicker": "测量数据",
      "title": "8848.86 米",
      "body": "中国与尼泊尔联合公布雪面高程, 较 2005 年测量保持一致",
      "onscreen": "8848.86m｜2020 中尼联合"
    },
    {
      "position": 3,
      "layout": "catalog",
      "kicker": "地理坐标",
      "title": "喜马拉雅山脉",
      "body": "位于喜马拉雅山脉中段, 中国西藏与尼泊尔边境",
      "onscreen": "中尼边境｜喜马拉雅中段"
    },
    {
      "position": 4,
      "layout": "quote",
      "kicker": "首次登顶",
      "title": "1953年5月29日",
      "body": "埃德蒙·希拉里与丹增·诺尔盖首次成功登顶",
      "onscreen": "1953.5.29｜人类首次登顶"
    },
    {
      "position": 5,
      "layout": "closer",
      "kicker": "持续探索",
      "title": "勇攀高峰",
      "body": "珠峰测量数据为地质研究、气候变化提供重要基准",
      "onscreen": "勇攀高峰｜科学探索"
    }
  ]
}
